{
  "$schema": "./symbiote.schema.json",
  "configVersion": 2,
  "name": "Symbiote",
  "emoji": "🤖",
  "defaultProvider": "openrouter",
  "defaultModel": "openrouter/free",
  "fallbackProviders": [],
  "temperature": 0.7,
  "maxTokens": 8192,
  "maxIterations": 50,
  "adaptiveTemperature": {
    "adaptive": false,
    "default": 0.5,
    "logChanges": false
  },
  "workspace": ".",
  "sessionsDir": ".session",
  "ownerIds": [],
  "apiHost": "127.0.0.1",
  "apiPort": 3006,
  "webHost": "0.0.0.0",
  "webPort": 3009,
  "allowedOrigins": [
    "http://127.0.0.1:3009",
    "http://localhost:3009"
  ],
  "toolProgress": true,
  "tools": {
    "enabled": true
  },
  "sandbox": {
    "enabled": true,
    "ownerAccess": true,
    "internalTier": "standard",
    "nonOwnerTier": "restricted"
  },
  "timeouts": {
    "llmRequestMs": 900000
  },
  "heartbeat": {
    "activeIntervalMin": 30,
    "idleIntervalMin": 120,
    "sleepingIntervalMin": 360,
    "quietHoursStart": 23,
    "quietHoursEnd": 8
  },
  "providers": {
    "openrouter": {
      "baseUrl": "https://openrouter.ai/api/v1",
      "apiKey": "${OPENROUTER_API_KEY}",
      "timeoutMs": 600000
    },
    "anthropic": {
      "apiKey": "${ANTHROPIC_API_KEY}"
    },
    "openai": {
      "apiKey": "${OPENAI_API_KEY}"
    },
    "gemini": {
      "apiKey": "${GEMINI_API_KEY}"
    },
    "groq": {
      "baseUrl": "https://api.groq.com/openai",
      "apiKey": "${GROQ_API_KEY}"
    },
    "xai": {
      "apiKey": "${XAI_API_KEY}"
    },
    "nvidia": {
      "apiKey": "${NVIDIA_API_KEY}"
    },
    "github-copilot": {},
    "ollama": {
      "baseUrl": "http://127.0.0.1:11434"
    },
    "gladius": {
      "baseUrl": "http://127.0.0.1:8741"
    }
  },
  "discord": {
    "enabled": false,
    "token": "${DISCORD_BOT_TOKEN}",
    "botId": "${DISCORD_CLIENT_ID}",
    "policy": {
      "dmPolicy": "allowlist",
      "groupPolicy": "mention-only",
      "requireMention": true,
      "allowedSenders": [],
      "allowedGroups": [],
      "ownerIds": []
    }
  },
  "whatsapp": {
    "enabled": false,
    "authDir": "~/.symbiote/whatsapp-auth",
    "autoRead": true,
    "markOnline": true,
    "policy": {
      "dmPolicy": "allowlist",
      "groupPolicy": "mention-only",
      "requireMention": true,
      "allowedSenders": [],
      "allowedGroups": [],
      "ownerIds": []
    }
  },
  "orchestrator": {
    "enabled": false
  }
}
